{
  "greatest": "2024-10-02T18:44:59Z",
  "id": "2024-10-02",
  "kind": "solar-eclipse",
  "provenance": {
    "attribution": "Eclipse predictions by Fred Espenak, NASA/GSFC",
    "source": "NASA Five Millennium Canon of Solar Eclipses, table SE2001-2100",
    "url": "https://eclipse.gsfc.nasa.gov/SEcat5/SE2001-2100.html"
  },
  "type": "annular"
}
