{
  "greatest": "2023-10-14T17:59:27Z",
  "id": "2023-10-14",
  "kind": "solar-eclipse",
  "provenance": {
    "attribution": "Eclipse predictions by Fred Espenak, NASA/GSFC",
    "source": "NASA Five Millennium Canon of Solar Eclipses, table SE2001-2100",
    "url": "https://eclipse.gsfc.nasa.gov/SEcat5/SE2001-2100.html"
  },
  "summary": "An annular eclipse from Oregon to Texas and on through Central America to Brazil.",
  "title": "Ring of fire across the Americas",
  "type": "annular"
}
