{
  "greatest": "2026-08-12T17:45:51Z",
  "id": "2026-08-12",
  "kind": "solar-eclipse",
  "provenance": {
    "attribution": "Eclipse predictions by Fred Espenak, NASA/GSFC",
    "source": "NASA Five Millennium Canon of Solar Eclipses, table SE2001-2100",
    "url": "https://eclipse.gsfc.nasa.gov/SEcat5/SE2001-2100.html"
  },
  "summary": "Totality crosses Greenland, Iceland and northern Spain just before sunset.",
  "title": "Iberian total eclipse",
  "type": "total"
}
