{
  "greatest": "2024-04-08T18:17:15Z",
  "id": "2024-04-08",
  "kind": "solar-eclipse",
  "provenance": {
    "attribution": "Eclipse predictions by Fred Espenak, NASA/GSFC",
    "source": "NASA Five Millennium Canon of Solar Eclipses, table SE2001-2100",
    "url": "https://eclipse.gsfc.nasa.gov/SEcat5/SE2001-2100.html"
  },
  "summary": "Totality crossed Mexico, the United States and Canada, with up to four and a half minutes of darkness.",
  "title": "Great North American Eclipse",
  "type": "total"
}
