{
  "greatest": "2016-03-09T01:57:09Z",
  "id": "2016-03-09",
  "kind": "solar-eclipse",
  "provenance": {
    "attribution": "Eclipse predictions by Fred Espenak, NASA/GSFC",
    "source": "NASA Five Millennium Canon of Solar Eclipses, table SE2001-2100",
    "url": "https://eclipse.gsfc.nasa.gov/SEcat5/SE2001-2100.html"
  },
  "summary": "Totality crossed Sumatra, Borneo and Sulawesi before heading out over the Pacific.",
  "title": "Indonesian total eclipse",
  "type": "total"
}
